{
  "schemaVersion": "1.0.0",
  "snapshotId": "snapshot-2001",
  "snapshotVersion": "v1",
  "snapshotSchemaVersion": "1.0.0",
  "snapshotCreatedAt": "2026-07-21T10:00:00+09:00",
  "digestAlgorithm": "sha256",
  "snapshotDigest": "sha256:aaaaaaaaaaaaaaaaaaaaaaaaaaaaaaaaaaaaaaaaaaaaaaaaaaaaaaaaaaaaaaaa",
  "snapshotReference": "snapshot://loan-2001/v1",
  "referenceType": "IMMUTABLE_REFERENCE"
}
